{
  "team": "example-reference",
  "corpus": "A",
  "generated_at": "2026-09-05T09:00:00Z",
  "system_notes": "Reference example, NOT a winning answer. It shows the shape of every section and deliberately leaves gaps: only two of three faults are diagnosed, one decoy is examined but not the others, and the self-assessment has a single cycle. Use it to validate your output against score.py, not as a target.",
  "metrics": [
    {
      "id": "m_containment",
      "name": "Containment rate",
      "ask_id": "A01",
      "grain": "session",
      "fidelity": "measured",
      "coverage": {
        "value": 1.0,
        "basis": "session_end is present on every session, v2 and v3 alike"
      },
      "calibration": null,
      "plan": {
        "source": "corpus/sessions.jsonl.gz",
        "filter": "session_end = 'resolved' OR (session_end = 'handoff' AND handoff_by_design = true)",
        "denominator": "all sessions in scope",
        "breakdowns": [
          "intent",
          "channel",
          "agent_kind",
          "agent_id"
        ],
        "alternatives_offered": [
          "resolution_rate \u2014 excludes by-design handoffs entirely"
        ]
      }
    },
    {
      "id": "m_tool_fail",
      "name": "Tool failure rate",
      "ask_id": "A04",
      "grain": "step",
      "fidelity": "measured",
      "coverage": {
        "value": 0.725,
        "basis": "v2_flow sessions emit no tool_call rows and are excluded from the denominator, not counted as zero-error",
        "excluded": [
          "agent_kind = v2_flow"
        ]
      },
      "calibration": null,
      "plan": {
        "source": "corpus/agent_steps.jsonl.gz WHERE step_type = 'tool_call'",
        "filter": "outcome IN ('error','timeout')",
        "denominator": "all tool_call steps on v3_agent sessions",
        "breakdowns": [
          "error_class",
          "tool_name",
          "channel",
          "agent_id"
        ]
      }
    },
    {
      "id": "m_useful_tool",
      "name": "Tool answered with something",
      "ask_id": "A04",
      "grain": "step",
      "fidelity": "derived",
      "coverage": {
        "value": 0.725,
        "basis": "derived from tool_call rows, same v3-only coverage"
      },
      "calibration": null,
      "plan": {
        "source": "corpus/agent_steps.jsonl.gz WHERE step_type = 'tool_call'",
        "filter": "outcome = 'ok' AND result_field_count = 0",
        "denominator": "all tool_call steps with outcome = 'ok'",
        "breakdowns": [
          "tool_name",
          "tool_version"
        ],
        "alternatives_offered": [
          "catalog lists this as derivable_not_declared \u2014 we derived and declared it"
        ]
      }
    },
    {
      "id": "m_turns",
      "name": "Turns to resolve",
      "ask_id": "A02",
      "grain": "session",
      "fidelity": "measured",
      "coverage": {
        "value": 1.0,
        "basis": "turn count is present on every session"
      },
      "calibration": null,
      "plan": {
        "source": "corpus/sessions.jsonl.gz",
        "filter": "session_end = 'resolved'",
        "denominator": "n/a \u2014 this is a distribution, reported as median and p90",
        "breakdowns": [
          "intent",
          "agent_id",
          "prompt_version"
        ]
      }
    },
    {
      "id": "m_quality",
      "name": "Judged quality",
      "ask_id": "A06",
      "grain": "session",
      "fidelity": "judged",
      "coverage": {
        "value": 1.0,
        "basis": "scored on every session"
      },
      "calibration": {
        "agreement": 0.87,
        "n": 96,
        "judge_version": "v1"
      },
      "plan": {
        "source": "corpus/sessions.jsonl.gz",
        "filter": "quality_score, SEGMENTED BY judge_version \u2014 never trended across the boundary",
        "denominator": "sessions within one judge_version",
        "breakdowns": [
          "intent",
          "judge_version"
        ]
      }
    },
    {
      "id": "m_abandon_reason",
      "name": "Abandonment with frustration",
      "ask_id": "A09",
      "grain": "session",
      "fidelity": "judged",
      "coverage": {
        "value": 1.0,
        "basis": "abandonment is measured; the REASON is judged and needs its own versioned rubric"
      },
      "calibration": {
        "agreement": 0.71,
        "n": 96,
        "judge_version": "v1"
      },
      "plan": {
        "source": "corpus/sessions.jsonl.gz JOIN corpus/turns.jsonl.gz",
        "filter": "session_end = 'abandoned', then a judged rubric over the last three turns",
        "denominator": "all abandoned sessions",
        "breakdowns": [
          "intent",
          "channel"
        ],
        "alternatives_offered": [
          "session_end='abandoned' alone is MEASURED but answers a different question"
        ]
      }
    }
  ],
  "standard": [
    {
      "tenant": "acme-bank",
      "cohort": {
        "intent": "product_info"
      },
      "metric": "turns_to_resolve",
      "exemplar_n": 412,
      "golden_set_version": "gs_v1",
      "best": 3.0,
      "median": 5.0,
      "deficit": 2.0,
      "derivation": "top decile of resolved sessions by turns, no tool error, no kb miss, quality >= 4 within judge_version v1"
    },
    {
      "tenant": "acme-bank",
      "cohort": {
        "intent": "product_info"
      },
      "metric": "resolution_rate",
      "exemplar_n": 412,
      "golden_set_version": "gs_v1",
      "best": 0.94,
      "median": 0.79,
      "deficit": 0.15,
      "derivation": "resolution rate of the exemplar cohort's intent-week strata"
    },
    {
      "tenant": "northwind-retail",
      "cohort": {
        "intent": "order_status"
      },
      "metric": "resolution_rate",
      "exemplar_n": 780,
      "golden_set_version": "gs_v1",
      "best": 0.95,
      "median": 0.86,
      "deficit": 0.09,
      "derivation": "top decile weeks for this intent before any config change in the window"
    },
    {
      "tenant": "acme-bank",
      "cohort": {
        "agent_id": "acme_main_v3"
      },
      "metric": "turns_to_resolve",
      "exemplar_n": 1105,
      "golden_set_version": "gs_v1",
      "best": 3.0,
      "median": 4.0,
      "deficit": 1.0,
      "derivation": "top decile of resolved sessions on this agent, prompt_version p_v3 only"
    }
  ],
  "findings": [
    {
      "id": "f1",
      "tenant": "acme-bank",
      "cohort": {
        "intent": "premium_card_info"
      },
      "metric": "resolution_rate",
      "window": {
        "from_day": 35,
        "to_day": 45
      },
      "observed": 0.31,
      "expected": 0.86,
      "is_regression": true,
      "severity": "critical",
      "evidence": [
        "cohort appears for the first time on day 34 and never reaches the tenant standard",
        "kb_top_score in this cohort sits at 0.11-0.38 against a tenant median of 0.79",
        "kb_hit is false on 100% of lookups in the cohort",
        "config_timeline day 34: kb kb_2026_06_a -> kb_2026_06_c 'premium card launch content pack'"
      ],
      "impact": {
        "conversations_affected": 239,
        "share_of_traffic": 0.0418,
        "downstream": {
          "would_have_resolved_at_baseline": 120,
          "unplanned_handoffs": 149,
          "abandoned": 15
        },
        "cost_usd": 13.58,
        "days_running": 11,
        "derivation": "239 sessions matched the cohort over 11 days (4.2% of this tenant's traffic in the window). Observed resolution 0.314 against a baseline of 0.816 (this cohort has no before-period, so the baseline is other question-answering intents on the same agent in the same window), so 120 conversations that would have resolved did not. 149 ended in a handoff the agent was not built to make; 15 were abandoned. cost_usd is the sum over the cohort and covers v3 traffic only."
      },
      "audience": [
        "agent_builder",
        "business_owner"
      ],
      "if_nothing_changes": "At the observed rate this costs about 11 unresolved conversations a day in this cohort, and 62% of them reach a human who was not meant to be involved. The product line is new, so these are first impressions of it."
    },
    {
      "id": "f2",
      "tenant": "northwind-retail",
      "cohort": {
        "intent": "order_status"
      },
      "metric": "resolution_rate",
      "window": {
        "from_day": 42,
        "to_day": 52
      },
      "observed": 0.766,
      "expected": 0.864,
      "is_regression": true,
      "severity": "high",
      "evidence": [
        "tool_failure_rate on get_order_status is FLAT across the window (0.015 -> 0.011)",
        "but result_field_count = 0 on 14% of outcome='ok' calls, up from 0%",
        "those sessions show a second get_order_status call with retry_count = 1",
        "config_timeline day 40: tool get_order_status 3.2.0 -> 3.3.0 'order service migration'"
      ],
      "impact": {
        "conversations_affected": 2630,
        "share_of_traffic": 0.297,
        "downstream": {
          "would_have_resolved_at_baseline": 216,
          "unplanned_handoffs": 394,
          "abandoned": 153
        },
        "cost_usd": 92.21,
        "days_running": 12,
        "derivation": "2630 sessions matched the cohort over 12 days (29.7% of this tenant's traffic in the window). Observed resolution 0.770 against a baseline of 0.852 (this intent's own resolution over the 12 days before the tool deploy), so 216 conversations that would have resolved did not. 394 ended in a handoff the agent was not built to make; 153 were abandoned. cost_usd is the sum over the cohort and covers v3 traffic only."
      },
      "audience": [
        "agent_builder",
        "platform_owner"
      ],
      "if_nothing_changes": "About 18 conversations a day that would previously have resolved now do not, and 394 people over the window reached a human for a question the agent used to answer. The tool reports itself as healthy throughout, so nothing will surface this on its own."